Heading,Description,Date_Source
"Who will get Shiv Sena party symbol? Shinde camp stakes claim, Team Uddhav asked to reply soon",Eknath Shinde faction of Shiv Sena met the Election Commission on Friday to stake claim for the party's 'bow and arrow' poll symbol ahead of the Andheri East assembly bypoll in Maharashtra.,"India TV News Desk | October 07, 2022 17:43 IST"
"Delhi: Row over AAP minister's oath at mass 'religious conversion' event, BJP demands action | Video",A video clip has also went viral showing Gautam's presence at a public mass religious conversion event.,"India TV News Desk | October 08, 2022 0:30 IST"
"Madhya Pradesh: 2 army personnel killed, 1 injured in tank barrel burst",Madhya Pradesh: Indian army personnel were killed during a military exercise in Babina. Army officials said that the incident occurred when the barrel of a tank burst during a military training exercise.,"India TV News Desk | October 07, 2022 15:58 IST"
RPSC Grade 1 admit card 2022 likely be released tomorrow at rpsc.rajasthan.gov.in - check details,"Rajasthan Public Service Commission is scheduled to conduct the RPSC Grade 1 exams from October 11, which will conclude on October 21.","India TV News Desk | October 07, 2022 15:05 IST"
Centre sets up 9-member taskforce for monitoring cheetahs in Kuno National Park,"Cheetahs in Kuno National Park: Earlier on September 25, Prime Minister Narendra Modi said that based on the recommendation of the task force set up to observe cheetahs in Madhya Pradesh's Kuno National Park, it will be decided when people will be able to see the animals.","India TV News Desk | October 07, 2022 14:11 IST"
'How can you allow this': Owaisi slams CM Bommai as mob enters Karnataka mosque,"Karnataka mosque issue: Reacting to the incident, AIMIM chief Asaduddin Owaisi tweeted that ""extremists"" attempted to desecrate the heritage monument.","India TV News Desk | October 07, 2022 13:32 IST"
Vande Bharat gets a 'nosejob' hours after collision with buffaloes; FIR against owners of cattle,"Vande Bharat Express accident: RPF inspector Pradeep Sharma posted at Vatva railway station said the FIR was filed under section 147 of the Railways Act, 1989, which deals with unauthorised entry into any part of a railway and misuse of its property.","India TV News Desk | October 07, 2022 13:26 IST"
Uttarakhand avalanche update: Death toll goes up to 26 as more bodies of mountaineers recovered,"Uttarakhand avalanche update: On Tuesday, about 41 trainees and instructors of the Nehru Institute of Mountaineering were hit by an avalanche.","India TV News Desk | October 07, 2022 16:10 IST"
National Herald case: Karnataka Congress president Shivakumar appears before ED in Delhi,"National Herald Case: Shivakumar, 60, told reporters before stepping into the ED office at A P J Abdul Kalam Road that he was a ""law-abiding citizen"" and hence he was deposed before the federal agency despite not knowing why was he exactly called.","India TV News Desk | October 07, 2022 12:23 IST"
Amit Shah inaugurated Dairy conclave during his three-day visit to the northeast,"According to Shah's itinerary for October 7, as posted on the microblogging site by his office, the home minister unveiled a statue of Sardar Vallabhbhai Patel at Rajbhavan in Gangtok.","India TV News Desk | October 07, 2022 15:13 IST"
"Jharkhand: Yet again in Dumka, girl set ablaze for refusing marriage proposal",Girl set ablaze in Dumka: This is the second such attack in around one month in Dumka in which a man attacked a woman just because she refused the marriage proposal.,"India TV News Desk | October 07, 2022 12:28 IST"
Gyanvapi case hearing: Varanasi court verdict on 'Shivling' carbon dating on Oct 11,"Gyanvapi case hearing: Carbon dating is a scientific process that ascertains the age of an archaeological object or archaeological finds.Besides this case, two more cases which could not be heard on Thursday due to the holiday will be heard on Oct 11.","India TV News Desk | October 07, 2022 14:41 IST"
Centre asks CJI UU Lalit to name successor before retiring on Nov 8,"As per the established practice of the Chief Justice naming the senior-most judge as his or her successor, Justice DY Chandrachud is expected to be appointed as the 50th Chief Justice of India.","India TV News Desk | October 07, 2022 11:53 IST"
"Governance focus has shifted outside Delhi, adopt holistic approach: PM Modi to new IAS officers","PM Modi to IAS Officers: Addressing officers of the 2020 batch in the concluding session of the Assistant Secretary Programme, 2022, Modi said on Thursday that they have the opportunity to serve the country during the 'Amrit Kaal' and help realise the 'Panch Pran'.","India TV News Desk | October 07, 2022 11:12 IST"
"Congress President Poll: Shashi Tharoor releases manifesto, pitches for limiting state chiefs' term",Congress President Election: Shashi Tharoor rejected the rumours that he may opt out of the Congress president race due to meagre support. The Thiruvananthapuram MP asserted that he was very much in the fray and he has been receiving huge support.,"India TV News Desk | October 07, 2022 10:43 IST"
Rupee falls 16 paise to all-time low of 82.33 against US dollar in early trade,The fall of Rupee: Indian currency Rupee (INR) loses 16 paise to all-time low of 82.33 against USD in early trade on Friday. A firm American currency and risk-averse sentiment among investors hurt the INR.,"India TV News Desk | October 07, 2022 10:10 IST"
Delhi excise policy: ED conducts fresh raids at 35 locations; '500 raids yet...' Kejriwal's jibe,"Delhi excise policy case: The Central probe agency carried out more than 103 raids, so far in this case till now. Today's ED raid triggered political reactions too. Delhi CM Arvind Kejriwal slammed ED/CBI saying even after 500 raids probe agency failed to get evidence against Manish Sisodia.","India TV News Desk | October 07, 2022 12:10 IST"
"Arvind Kejriwal takes fresh jibe at L-G VK Saxena, says 'Even my wife doesn't scold me'",Arvind Kejriwal VS L-G VK Saxena: The Delhi CM lined out a piece of advice on a lighter note as he jibed at the Centre and BJP without naming anybody specific.,"India TV News Desk | October 07, 2022 9:51 IST"
"India reports over 1,900 fresh COVID-19 cases in last 24 hrs, active cases come down to 30,362","COVID-19: The total active cases in India have decreased to 30,362, the health ministry data showed on Friday.","India TV News Desk | October 07, 2022 9:39 IST"
"Chhath Puja 2022: 2,269 trips of 179 pairs of special trains till festival, says Ministry of Railway",Chhath Puja 2022: Indian Railways receive a huge number of footfalls before and after Chhath festival and people go to their hometowns to celebrate the puja with their family and Railways arranges special trains to reduce the rush.,"India TV News Desk | October 07, 2022 8:19 IST"
50 per cent work on Ayodhya Ram Mandir completed: CM Yogi Adityanath,"Ayodhya Ram Mandir: While addressing the 'Sant Samagam', Chief Minister Yogi said, ""India's Sanatan Dharm gives utmost importance to the protection of our 'Gau Matas' (cows).""","India TV News Desk | October 07, 2022 8:05 IST"
"Delhi-NCR wakes up to rainy morning, mercury dips",Rains in Delhi-NCR: People in Delhi and the National Capital region witnessed a rainy and windy morning on Friday.,"India TV News Desk | October 07, 2022 7:01 IST"
Jammu and Kashmir: Hybrid terrorist affiliated with LeT apprehended,Jammu and Kashmir: The terrorist apprehended has been identified as Yawar Ahmed.,"India TV News Desk | October 07, 2022 6:54 IST"
"Breaking News, October 7","IndiaTV News provides you all the breaking news, latest news, breaking story videos, Live TV on a single platform to ensure you don't miss the biggest happenings in India and the world.","India TV News Desk | October 08, 2022 0:10 IST"
"Aaj Ki Baat: Full episode, October 6, 2022",India's Number One and the most followed Super Prime Time News Show ‘Aaj Ki Baat – Rajat Sharma Ke Saath was launched just before the 2014 General Elections.,"India TV News Desk | October 07, 2022 0:13 IST"
We have been victim of state-sponsored cross-border terrorism for nearly past 3 decades: India at UN,India expressed hope that a special meeting of the UN Security Council Counter Terrorism Committee it is hosting later this month will contribute positively towards creating a global architecture that effectively responds to the new tech tools deployed by terrorists.,"India TV News Desk | October 07, 2022 0:26 IST"
Make Uttar Pradesh roads pothole-free by Nov 15: CM Yogi to officials,"During a high-level meeting, he also reviewed preparations for the 81st session of the Indian Road Congress (IRC) to be held in Lucknow from October 8, a spokesperson said.","India TV News Desk | October 07, 2022 0:24 IST"
'Not going to withdraw': Shashi Tharoor dismisses rumours of opting out of Congress President race,"Rumours I am going to withdraw (nomination) are false. I am receiving so much support that if I wouldn't have been democratically inclined, I would have asked the other candidate to withdraw, Shashi Tharoor said.","India TV News Desk | October 07, 2022 6:11 IST"
"Delhi, Uttar Pradesh likely to see heavy rain spell, strong winds from today","The IMD has predicted a heavy rainfall spell from Friday onwards. The upcoming rain spell may continue for 3-4 days, it said.","India TV News Desk | October 07, 2022 6:12 IST"
"Noida society resident, guard arrested after fight over dog in sector 74","The resident was identified as Anurag Sharma (35), a banker, while the guard as Rishabh Kumar (27), police said.","India TV News Desk | October 06, 2022 22:54 IST"
India abstains from voting on draft resolution in UN on human rights situation in China’s Xinjian,"India on Thursday abstained from voting on a draft resolution in the UN Human Rights Council on holding a debate on the human rights situation in China’s Xinjiang province, sources said.","India TV News Desk | October 07, 2022 6:13 IST"
Delhi: 11-year-old allegedly gang-raped by two seniors inside washroom of Kendriya Vidyalaya,The alleged incident had taken place in July but the victim approached the police on Tuesday only after the matter was highlighted by the Delhi Commission for Women (DCW).,"India TV News Desk | October 06, 2022 21:12 IST"
Threat call to Ambanis: One person arrested from Bihar's Darbhanga,"After tracing the mobile number, it was found that the caller was from Darbhanga. Mumbai police contacted us yesterday and based on their information, we caught hold of the caller, Rakesh Kumar Mishra, within 2 hours, said Awakash Kumar, SSP, on the Mukesh Ambani threat case.","India TV News Desk | October 06, 2022 20:31 IST"
Govt asks WHO to share report on child deaths in Gambia linked with India-made cough syrups,"Enquiry of CDSCO said that Maiden Pharma, Haryana, a manufacturer licensed by the State Drug Controller for products Promethazine Oral Solution BP, Kofexnalin Baby Cough Syrup, MaKoff Baby Cough Syrup & MaGrip n Cold Syrup and has manufacturing permission of these products for export only.","India TV News Desk | October 07, 2022 6:12 IST"
Gambia urgently recalls India-made cough syrups linked to 66 child deaths,"Speaking to The Associated Press, the Director of Health Dr. Mustapha Bittaye confirmed the wave of child deaths from acute kidney injury, sending shockwaves across the country of 2.4 million people and around the world.","India TV News Desk | October 06, 2022 19:12 IST"
Mumbai: Women hit each other on Thane-Panvel local train after argument over seat,"The incident happened on the Thane-Panvel local train near Vashi in Navi Mumbai, said S Katare, Senior Police Inspector, Vashi Railway Station.","India TV News Desk | October 07, 2022 0:25 IST"
Haryana: NHRC notice to Khattar government over sewer deaths in Faridabad,"Sewer deaths in Faridabad: In spite of clear guidelines of the Supreme Court in place, the local authorities hardy follow the norms, NHRC observed.","India TV News Desk | October 06, 2022 18:32 IST"
"Mulayam Singh still in ICU, on life-saving drugs, says Gurugram hospital","Mulayam Singh ji is still critical and on life saving drugs, he is being treated in the ICU Medanta hospital, Gurugram, by a comprehensive team of specialists,"" the hospital said.","India TV News Desk | October 06, 2022 17:40 IST"
"Delhi: Man held at airport for smuggling wrist watches, including one worth Rs 27.09 crore | In Pics","Airport Customs officials seized 7 highly precious watches, the value of one of the watches is Rs 27.09 crore. Official arrested the man who tried to smuggle the watches.","India TV News Desk | October 06, 2022 17:22 IST"
Ambani family has been target of threats over the years,"Mumbai Police on Thursday arrested Rakesh Kumar Mishra (30) from Darbhanga in Bihar for allegedly making calls to Sir HN Reliance Foundation Hospital in the last two days, threatening to blow up the hospital and kill Ambani, his wife Nita and sons Akash and Anant.","India TV News Desk | October 06, 2022 17:18 IST"
Opinion | How Mohan Bhagwat has changed RSS,"In his address, Bhagwat said, ‘Hindus neither scare others, nor do they fear others…This is our Bharatiya sanskriti (Indian culture)’. He also said, ‘putting women on the pedestal of a goddess is not sufficient, they must be given equal rights’.","India TV News Desk | October 06, 2022 16:18 IST"
"Tamil Nadu: 3 boys die, 11 hospitalised over suspected food poisoning",Tamil Nadu: The boys had rice mixed with 'rasam' and laddu for dinner on Wednesday. Some of them vomited and had dysentery.,"India TV News Desk | October 06, 2022 16:24 IST"
Rajasthan: Man beaten to death on suspicion of having affair in Kota,"A man was killed by three for having affair with a woman in Kunjvihar Colony on Atru Road under Baran City police station limits, Kota","India TV News Desk | October 06, 2022 16:08 IST"
"Newly launched Vande Bharat Express hits buffalo herd on Mumbai-Gandhinagar route, gets damaged",Mumbai-Gandhinagar Vande Bharat Express met an accident days after being flagged off by Prime Minister Narendra Modi. The first Vande Bharat Express from Delhi to Varanasi was launched in 2019.,"India TV News Desk | October 06, 2022 15:44 IST"
Chhattisgarh: Three sadhus thrashed on suspicion of being child-lifters; 30 summoned for questioning,Chhattisgarh: The suspicion arose while the victims were seen speaking to some children at a Dussehra fair by some people.,"India TV News Desk | October 06, 2022 14:23 IST"
"UKSSSC paper leak case: Chargesheet against expelled BJP leader Hakam Singh, 9 others","UKSSSC paper leak case: As many as 41 people, including Gaurav Chauhan, the Additional Private Secretary in the Public Works and Forest Department of State Secretariat, allegedly involved in the paper leak case have been arrested so far.","India TV News Desk | October 06, 2022 14:13 IST"
'Heights of chamchagiri': Congress leader's remarks on President Murmu sparks row,"The National Commission for Women (NCW) took serious note of the remarks and sent a notice to the leader, and demanded an apology.","India TV News Desk | October 06, 2022 14:05 IST"
Tamil Nadu weather: IMD predicts heavy rainfall till October 9,"Tamil Nadu weather: On October 5, sporadic rains hit parts of Chennai and adjoining districts.","India TV News Desk | October 06, 2022 14:04 IST"
Indian-origin family's murder in California: Punjab CM Mann urges Jaishankar for high-level probe,"Indian-origin killing in California: The family, originally from Harsi Pind in Hoshiarpur, Punjab, was kidnapped from their newly-opened trucking business in Merced County, California, on Monday.","India TV News Desk | October 06, 2022 14:06 IST"
Maa & Politics: Congress tweets Rahul’s pic tying shoelaces of Sonia Gandhi during Bharat Jodo Yatra,"Congress Bharat Jodo Yatra: It seems former Congress president Rahul Gandhi has developed an understanding of the power of optic politics. Recently, his picture in which he is seen addressing a gathering during the rain was tweeted by Congress' official handle.","India TV News Desk | October 06, 2022 14:06 IST"
ISRO to launch 36 satellites onboard LVM3 this month,"According to ISRO, the 36 satellites have undergone health checks successfully and has been integrated with the dispenser unit.","India TV News Desk | October 06, 2022 13:56 IST"
Karnataka: Tremors felt in Shiralakoppa town of Shivamogga district; locals in panic,Karnataka: The District Commissioner and the State Weather Department have been informed about the earthquake. Much clarity will be gained after the report comes out.,"India TV News Desk | October 06, 2022 13:27 IST"
'Does not make any impact': CM Bommai on Sonia Gandhi joining Bharat Jodo Yatra in K'taka,Bharat Jodo Yatra: The Congress party insiders said that the leaders of the party are thrilled about Sonia Gandhi's participation in the rally.,"India TV News Desk | October 06, 2022 13:38 IST"
Threats to Mukesh Ambani's family: One arrested from Bihar's Darbhanga,Threats to Mukesh Ambani's family: The accused had reportedly made the threat calls on a call centre number of Sir HN Reliance Foundation Hospital threatening to blow up the hospital and kill the members of Ambani family.,"India TV News Desk | October 06, 2022 12:59 IST"
PFI Ban: Delhi High Court's Justice Dinesh Kumar Sharma to head UAPA tribunal,PFI Ban: The appointment of Justice Sharma was made on the request of the law ministry. The ministry requested the chief justice of the Delhi High Court to recommend a judge to head the tribunal.,"India TV News Desk | October 06, 2022 12:38 IST"
Amit Shah J&K visit: When HM paused his speech for 'azaan' from mosque | WATCH,"In the video, which went viral in no time, it is seen that the home minister who heard the 'azaan' from the mosque, asked if anything was going on in the nearby mosque. After confirming with people on stage, he took a brief pause before restarting the speech with permission from the audience.","India TV News Desk | October 06, 2022 12:39 IST"
"District courts are not 'secondary', they are core of judicial system: SC Judge Justice Abhay S Oka",Supreme Court judge justice Abhay S Oka hailed the role of courts at the district and taluka level as they provide justice to the common people.,"India TV News Desk | October 06, 2022 12:15 IST"
Delhi: 19-year-old charred to death in Gandhi Nagar market fire,"Gandhi Nagar fire: ""The fire was declared of a medium category. A total of 28 fire tenders are engaged. Fire is now under control and confined to the top floors,"" said Deputy Chief Fire Officer SK Dua.","India TV News Desk | October 06, 2022 12:03 IST"
India's drug regulator initiates probe after WHO flags four cough syrups linked to deaths in Gambia,"India's drug regulator has already taken up an urgent investigation into the matter with regulatory authorities in Haryana, based on the available information, sources have said.","India TV News Desk | October 06, 2022 11:45 IST"
Uttarkashi avalanche: Experts from Gulmarg to assist rescue trapped mountaineers on Danda-II peak,"Uttarkashi avalanche update: The expert team has joined the operation with the State Disaster Response Force, Indo-Tibetan Border Police, and Nehru Institute of Mountaineering.","India TV News Desk | October 06, 2022 11:26 IST"
"MP: Acid attack, celebratory firing, death of minor reported in 10-day long Navratri festivities","MP: Amid controversies over ID cards made mandatory at the Garba venues, an 11-year-old girl, who was watching the progress in Indore, was found dead under mysterious circumstances on the last day.","India TV News Desk | October 06, 2022 11:24 IST"
Delhi weather update: Rains likely to improve air quality; minimum temperature at 22.4° C,"Delhi weather update: With the air quality in Delhi dropping to the 'poor' level on Wednesday, authorities in the National Capital Region have been asked to strictly implement measures under the first stage of the Graded Response Action Plan (GRAP).","India TV News Desk | October 06, 2022 10:47 IST"
Sonia Gandhi joins Rahul Gandhi-led Congress' 'Bharat Jodo Yatra' in Karnataka's Mandya,Congress Bharat Jodo Yatra: Party president Sonia Gandhi after a long time appeared at a large public event to strengthen the ongoing party's Padayatra Yatra which is being led by her son-led Rahul Gandhi.,"India TV News Desk | October 06, 2022 13:37 IST"
"COVID-19: India reports over 2,500 fresh cases in last 24 hours, active cases come down to 32,282","COVID-19: The total active cases in India have decreased to 32,282, the health ministry data showed on Thursday.","India TV News Desk | October 06, 2022 9:38 IST"
"Kerala: 9 killed, 38 injured after tourist bus hits state transport bus in Palakkad","Palakkad bus accident: The accident occurred at around 11.30 pm on Wednesday, an officer of the Vadakkenchery police station said.","India TV News Desk | October 06, 2022 12:21 IST"
Uttar Pradesh: Former Army man held in Muzzafarnagar for seeking re-entry through Agniveer scheme,Muzaffarnagar news: The accused identified as Kamal Singh had earlier been expelled from the Army when it was found that he had gained entry using fake documents and a fake name- Rahul Singh.,"India TV News Desk | October 06, 2022 7:37 IST"
"Delhi's air quality turns 'poor', CAQM asks states to strictly enforce pollution control measures","Delhi air quality news: The CAQM on Wednesday announced an immediate ban on all construction and demolition activity carried over an area of 500 sqm. and above that are not registered on the web portals created by the governments of Delhi, Haryana and Uttar Pradesh.","India TV News Desk | October 06, 2022 8:08 IST"
"Breaking News, October 6 | LIVE UPDATES","IndiaTV News provides you all the breaking news, latest news, breaking story videos, Live TV on a single platform to ensure you don't miss the biggest happenings in India and the world.","India TV News Desk | October 07, 2022 15:18 IST"
WHO says probing four Indian syrups after 66 kids die in Gambia,WHO had on September 29 informed the Drugs Controller General of India that it was providing technical assistance and advice to The Gambia.,"India TV News Desk | October 06, 2022 9:46 IST"
Opinion | How Krishna’s land Dwarka was filled up with ‘mazars’ and ‘dargahs’,Dwarka Dham is considered one of the four most sacred pilgrimage shrines (Dhams) among more than a billion Hindus. This is the place where Lord Krishna met his poor classmate Sudama.,"India TV News Desk | October 06, 2022 1:00 IST"
"Aaj Ki Baat: Full episode, October 5, 2022",India's Number One and the most followed Super Prime Time News Show ‘Aaj Ki Baat – Rajat Sharma Ke Saath was launched just before the 2014 General Elections.,"India TV News Desk | October 06, 2022 0:50 IST"
Bengal: 8 dead in flash floods during Goddess Durga idol immersion in Jalpaiguri | Video,The incident took place in the evening when hundreds of people gathered on the banks of the Mal river to participate in the immersion ceremony.,"India TV News Desk | October 06, 2022 7:13 IST"
"Uddhav Thackeray, Eknath Shinde trade charges at different Dussehra rallies in Mumbai","While Uddhav Thackeray said that as per the yearly tradition, the Ravana Dahan ceremony will be done but the Ravana is different this year labelling rebel Eknath Shinde as 'Katappa', the latter responded saying even the Katappa had self respect but was not double standard like him.","India TV News Desk | October 06, 2022 0:05 IST"
Don’t leave Eknath Shinde alone: Uddhav's brother Jaidev shares stage with Maha CM at Dussehra rally,"Speaking at the Dussehra rally, Eknath Shinde said, ""This is not your (Uddhav Thackeray) private Limited company. The Shiv Sena is of shiv-sainiks who have given their sweat for it. Not for people like you, who did partnerships & sold it.""","India TV News Desk | October 05, 2022 22:18 IST"
'Ravana of this year is different': Uddhav hits out at Eknath Shinde during Dussehra rally,"As per our yearly tradition, there will be a 'Ravana Dahan' ceremony, but the Ravana of this year is different. With time, Ravana also changes... He used to be 10-headed till now... how many heads does he have now? He is 50 times more betraying, Uddhav Thackeray said.","India TV News Desk | October 05, 2022 23:28 IST"
"TRS is now Bharat Rashtra Samithi (BRS), Telangana CM KCR launches national party","Heralding the party's foray into national politics more than 21 years after it was launched with the objective of carving out a separate Telangana from the state of Andhra Pradesh, the TRS adopted a unanimous resolution at its general body meeting rechristening it as BRS.","India TV News Desk | October 05, 2022 20:21 IST"
Yamunanagar: Major accident averted during Ravan dahan after effigy falls on people gathered | Video,A major accident was averted during Ravan Dahan in Yamunanagar where the effigy of Ravana fell on the people gathered.,"India TV News Desk | October 05, 2022 23:18 IST"
CM Yogi Adityanath feeds Leopard Cub in Gorakhpur | WATCH,The cub initially was trying to resist from drinking the milk but CM Yogi took the cub in his hands wearing protective gloves and fed the wild animal.,"India TV News Desk | October 05, 2022 19:43 IST"
RSS chief Mohan Bhagwat says concept of Hindu Rashtra being taken seriously,"Raising concerns over inequality, Mohan Bhagwat said ""unless temples, water sources and cremation grounds are open to all Hindus, till such time the talk of equality will be a mere pipe dream"".","India TV News Desk | October 05, 2022 18:31 IST"
"Bihar Municipal Elections: Fresh polls only after quotas are restored, says JD(U)","Bihar Municipal Elections: “We suspect the BJP’s hand in the goof-up. The party and its parent body RSS have always been opposed to quotas,” the JD(U) leaders alleged.","India TV News Desk | October 05, 2022 18:18 IST"
