Heading,Description,Date_Source
Bihar Boy Killed By Brothers Of Girl Who Mistook Exam Chit For Love Letter. Body Found In Pieces,The boy accompanied his sister to school for her exam and tried to help her with chit. She mistook it for love letter and informed her brothers.,"Reported by Manish Kumar, Edited by Amit Chaturvedi | Thursday October 20, 2022"
"Not Just Shiv Sena's Future, India's Democracy At Stake: Uddhav Thackeray","Former Maharashtra chief minister Uddhav Thackeray, who is fighting a legal battle to claim the legacy of the Shiv Sena, on Thursday claimed that not just the future of party but democracy in the country was at stake.","Press Trust of India | Thursday October 20, 2022, Mumbai"
"BJP Chief's Pic Placed In Grave In Telangana, Party Condemns Incident",Bharatiya Janata Party's (BJP) national president JP Nadda's picture was recent dug in a grave over the delay in setting up of Regional Fluoride Mitigation and Research Centre in Choutuppal area in Telangana's Munugode.,"Asian News International | Thursday October 20, 2022, Nalgonda (Telangana)"
"Gurugram Student, Who Allegedly Slit Junior's Throat Over Exam, Gets Bail","The teen was accused of murdering the class 2 student of the same school, picked at random, to defer an approaching examination and a parent-teacher meeting.","Reported by Arvind Gunasekar, Edited by Akhil Kumar | Thursday October 20, 2022, New Delhi"
"Full Text Of Congress's Reply To Shashi Tharoor ""Poll Irregularities"" Charge",The Congress has responded to allegations by party leader Shashi Tharoor that there were irregularities in the election to the party chief's post held on Monday.,"Edited by Debanish Achom | Thursday October 20, 2022, New Delhi"
"""Let Us Breathe Clean Air"": Supreme Court Denies Hearing On Delhi Crackers Ban","BJP MP Manoj Tiwari's plea wants ban lifted, but court refuses to pass order, clubs his plea with other petitions for later","NDTV News Desk | Thursday October 20, 2022, New Delhi"
"HCL's Shiv Nadar 'India's Most Generous', Donated ₹ 3 Crore Per Day: Report","HCL founder Shiv Nadar topped as the most generous person in the country with an annual donation of ₹ 1,161 crore, the EdelGive Hurun India Philanthropy List 2022 revealed on Thursday.","Press Trust of India | Thursday October 20, 2022, Mumbai"
Bailout For Near-Bankrupt Vodafone May Just Have Been Cleared: Report,"The country's capital market regulator approved the government's proposal to convert dues of over $1.92 billion by telecom operator Vodafone Idea to equity, two senior government officials said on Thursday.","Reuters | Thursday October 20, 2022, New Delhi"
"Congress MLA In Kerala Gets Advance Bail In Rape, Attempt-To-Murder Case",A Kerala sessions court here on Thursday granted anticipatory bail to Congress MLA Eldhose Kunnappilly facing charge of rape and attempt to murder. He is untraceable.,"Press Trust of India | Thursday October 20, 2022, Thiruvananthapuram"
"""One Face Before Us, Another Before Media"": Congress Slams Shashi Tharoor","After declaring a new party president, the Congress today called Shashi Tharoor two-faced in a sharp pushback against his allegations of ""extremely serious irregularities"" in the internal polls.","Reported by Sunil Prabhu, Edited by Deepshikha Ghosh | Thursday October 20, 2022, New Delhi"
Himachal Pradesh Polls: BJP Announces 6 Candidates For Remaining Seats,"The BJP on Thursday announced candidates for the remaining six seats for Himachal Pradesh polls, a day after it declared 62 names for the contest slated for next month.","Press Trust of India | Thursday October 20, 2022, New Delhi"
"PM Modi To Visit Kedarnath Tomorrow, Preparations In Full Swing",Preparations are in full swing ahead of Prime Minister Narendra Modi's visit to Kedarnath and Badrinath to lay the foundation stone of a few roads and the Hemkund Sahib ropeway on Friday.,"Asian News International | Thursday October 20, 2022, Kedarnath"
"""Maa, Maa..."": 2-Year-Old Sits With Mother's Body In Hospital, No One Helped","Community Health Centre staff waited for police to arrive from 15 km away, which took 6 hours, before shifting the body to the mortuary","Reported by Harsha Kumari Singh, Edited by Aarish Chhabra | Thursday October 20, 2022, Jaipur"
Jaish Chief Masood Azhar Charged For Jammu Terror Attack Ahead Of PM Visit,"Five Pakistani terrorists, including Jaish-e-Mohammed chief, were among 12 people chargesheeted in a case related to a terror attack in April ahead of PM Modi's maiden visit to Jammu and Kashmir after the abrogation of Article 370, an official said.","Press Trust of India | Thursday October 20, 2022, Jammu"
"Video Of Firecracker Celebration Is Latest Flashpoint Between BJP, AAP","Several other BJP leaders have tweeted the video, questioning the ""hypocrisy"" and ""double standard"" of the Delhi government. They have also given the matter a communal colour.","Edited by Akhil Kumar | Thursday October 20, 2022, New Delhi"
"India's Defence Sector Is In ""Golden Period"": Rajnath Singh","The current era is a ""golden period"" of the Indian defence sector, said Defence Minister Rajnath Singh at Defence Expo in Gandhinagar on Thursday.","Asian News International | Thursday October 20, 2022, Gandhinagar"
Hyderabad Auto Driver Dies By Suicide Amid Harassment Over Loan: Cops,An auto driver in Hyderabad died by suicide over alleged harassment by loan financiers. Hyderabad Kulsumpura Police Station has booked the company under FIR.,"Asian News International | Thursday October 20, 2022, Telangana"
"""Strange"": Minister As Tea-Seller Named For Himachal Seat He Won 4 Times","A tea shop owner in Himachal Pradesh's Shimla has replaced BJP minister Suresh Bhardwaj, who has contested the Shimla Urban seat four times consecutively.","Asian News International | Thursday October 20, 2022, Shimla"
"Employee At Top Bank, Wife Duped Ex Senior Lok Sabha Official Of Crores","A retired deputy director of security at the Lok Sabha was allegedly looted for crores on the pretext of investments in mutual funds and shares, police said.","Press Trust of India | Thursday October 20, 2022, Gurugram"
Agra District Jail Inmates To Make 1 Lakh Diyas With Cow Dung For Diwali,Diyas made from cow dung will light up homes here this Diwali. The district jail has roped in 12 of its inmates to prepare one lakh such diyas ahead of the festival.,"Press Trust of India | Thursday October 20, 2022, Agra"
No Flights To Sikkim Now. Here's Why,"In a letter to the Director of Pakyong Airport, the airline said, ""SpiceJet has decided to suspend operations out of Pakyong from 30th October 2022 till further notice. This is due to operation requirements.""","Written by Saurabh Gupta | Thursday October 20, 2022, New Delhi"
"Mumbai Builder Dies, Jumped From Home Gym On 23rd Floor","Well known real estate developer Paras Porwal allegedly died by suicide after jumping from the 23rd floor of a building in Mumbai today, a police official said.","Press Trust of India | Thursday October 20, 2022, Mumbai"
"Explosion At Firecracker Godown in Madhya Pradesh, 4 Killed",Explosion led to collapse of house where firecrackers were stored in Morena district,"NDTV News Desk | Thursday October 20, 2022, Bhopal"
Possible Cyclone Likely To Reach Bengal-Bangladesh Coasts By October 25,"The India Meteorological Department (IMD) on Thursday said that the possible cyclonic formation in the Bay of Bengal is likely to reach West Bengal-Bangladesh coasts by October 25, skirting Odisha.","Press Trust of India | Thursday October 20, 2022"
Jharkhand Woman Suffers Burn Injuries After Dispute With Live-In Partner: Police,"A 22-year-old woman suffered serious burn injuries in Jharkhand's Dumka district after a dispute with her live-in partner, police said on Thursday.","Press Trust of India | Thursday October 20, 2022, Dumka"
"Courts Take Too Many Holidays, Says New Petition. To Be Heard After Diwali Break","The Bombay High Court today said it would hear after Diwali holidays a public interest litigation challenging the practice of courts taking long vacations, thereby affecting filing and hearing of cases.","Press Trust of India | Thursday October 20, 2022, Mumbai"
"""We Condemn VIP Culture"": Doctors Oppose AIIMS SOPs For Treatment Of MPs",The Federation of Resident Doctors Association (FORDA) and other doctors' associations have opposed the AIIMS director's move over havingstandard operating procedures (SOPs) for sitting Members of Parliament.,"Asian News International | Thursday October 20, 2022, New Delhi"
"Bengal Girl Travelled 30 Km, Tried To Sell Blood To Pay For Smartphone","The 17-year-old girl, who is from the Tapan area of South Dinajpur, told authorities that she had recently ordered a smartphone online, and it occurred to her that she can get the money to pay for it by donating blood to the hospital.","Reported by Saurabh Gupta, Edited by Akhil Kumar | Thursday October 20, 2022, Kolkata"
Watch: Rahul Gandhi's Heartwarming Moment With Elderly Woman,"A video of an old woman embracing and blessing Congress leader Rahul Gandhi during the Bharat Jodo Yatra has surfaced on the Internet. Mr Gandhi, along with his party workers,continues to march with the aim to reach Kashmir from Kanyakumari traversi","Edited by NDTV News Desk | Thursday October 20, 2022"
"This Diwali, PM's ""Gift"" To 75,000 Young People Across The Country","Jobs will be allocated in the Defence Ministry, Railway Ministry, Post department, Home Ministry, Labour and Employment Ministry, Central Industrial Security Force, Central Bureau of Investigation, Customs, and Banking, among others.","Reported by Akhilesh Sharma, Edited by Akhil Kumar | Thursday October 20, 2022, New Delhi"
"Watch: Rail Cop, Traveling Without Ticket, Lashes Out At Official",A railway police personnel in Bihar pulled out his belt to hit a ticket examiner after a heated argument over being asked to show his ticket.,"Reported by Manish Kumar, Edited by Chandrajit Mitra | Thursday October 20, 2022, Patna"
"Fired Top Leader In 10 Minutes For ""Huge Integrity Violation"": Wipro Boss","""We made that decision in 10 minutes. It was an important role that this person ran for the organisation but when the times are tough, and you have to make those tough calls,"" he said, according to a report in Moneycontrol.","NDTV News Desk | Thursday October 20, 2022, New Delhi"
Satya Nadella Receives Padma Bhushan In US; Plans To Visit India In January,"Microsoft CEO Satya Nadella has said it is an honour for him to receive the Padma Bhushan, the third-highest civilian award and he looks forward to continuing to work with people across India to help them use technology to achieve more.","Press Trust of India | Thursday October 20, 2022"
Mukesh Ambani Buys Dubai Mansion From Kuwait Tycoon's Family. It Cost...,"Mukesh Ambani is building upon his Dubai property empire with another beach-side villa purchase, smashing his prior record for the city's most expensive residential real estate deal within a matter of months.","Ben Bartenstein and Saritha Rai, Bloomberg | Thursday October 20, 2022"
"2,141 New Covid Cases In India, 20 Virus-Related Deaths In 24 Hours","India saw a single day rise of2,141coronavirus infections, taking the tally of COVID-19 cases 4,46,36,517, while the active cases declined to25,510, according to the government data updated on Thursday.","Press Trust of India | Thursday October 20, 2022, New Delhi"
"Delhi, Kolkata, Ahmedabad Among World's ""Most Unsustainable"" Megacities","With 10 billion people expected to cram into urban areas by mid-century, the world will add at least 14 new megacities - many of which are at risk of threats including food and water insecurity, conflict and high crime rates.","Linda Poon, Bloomberg | Thursday October 20, 2022"
"Video: Body On Shoulder, Madhya Pradesh Man Walks On Busy Road To Bus Stop","A man carried the body of his four-year-old niece, who died in a freak accident, and took a bus to his village because he could not get a hearse from a hospital in Madhya Pradesh.","Reported by Anurag Dwary, Edited by Chandrajit Mitra | Thursday October 20, 2022, Bhopal"
3 Members Of Banned Group Popular Front Arrested In Maharashtra's Raigad District,"The Maharashtra Anti-Terrorism Squad has arrested four activists of the proscribed Popular Front of India (PFI) from Panvel in neighbouring Raigad district, an official said on Thursday.","Press Trust of India | Thursday October 20, 2022, Raigad (Maharashtra)"
"On Rahul Gandhi Declaring Congress Chief Before Results, Party Explains",Congress leader Jairam Ramesh on Wednesday defended Rahul Gandhi for referring to veteran leader Mallikarjun Kharge as the new Congress president even before the result of the party election was announced.,"NDTV News Desk | Thursday October 20, 2022, New Delhi"
"AIIMS Head's Letter Seeking Smooth Medical Facilities For MPs Cites ""SOP""",The director of AIIMS Delhi on Wednesday wrote a letter to the Lok Sabha Joint Secretaryover streamlining medical services for the Members of Parliament.,"Asian News International | Thursday October 20, 2022, New Delhi"
"Sonia Gandhi Has Last Word In Congress, Likely To Remain So: Ex-Party Leader",Former Congress leader Ashwani Kumar has said the election of Mallikarjun Kharge as party president by a huge margin shows Sonia Gandhi has the last word in the organisation's internal politics.,"Press Trust of India | Thursday October 20, 2022, New Delhi"
Union Minister Slams Manish Sisodia For Criticising Gujarat Schools,"Union Health Minister Mansukh Mandaviya slammed AAP leader Manish Sisodia criticising Gujarat schools, saying Delhi's education minister should study PM Narendra Modi's initiatives when he was CM and implement them in the national capital.","Press Trust of India | Thursday October 20, 2022, New Delhi"
"Coronavirus Highlights: India Sees 2,141 New Covid Cases, 7 Deaths In 24 Hours","India reported 2,141 new coronavirus cases, taking the tally of cases 4,46,36,517, while active cases declined to 25,510, according to the government data updated on Thursday.","NDTV News Desk | Thursday October 20, 2022, New Delhi"
Kerala Man Arrested For Thrashing Wife Who Refused To Quit Her Job,"Malayinkeezhu police on Wednesday arrested a 27-year-old man for brutally thrashing his wife and filming, at the Thiruvananthapuram district, Kerala.","Asian News International | Thursday October 20, 2022, Thiruvananthapuram"
Security Stepped Up In Mumbai After Police Receives Bomb Threat Call,Mumbai police on Wednesday received a 'suspicious' call from an unidentified caller informing that bombs are planted at several key places across Mumbai.,"Asian News International | Thursday October 20, 2022, Mumbai"
What US Said On Pulitzer-Winning Journalist Being Stopped At Delhi Airport,"The United States is aware of reports of Pulitzer-winning Kashmiri journalist Sanna Irshad Mattoo allegedly being prevented from travelling to the country, a State Department official has said.","Press Trust of India | Thursday October 20, 2022, Washington"
PM Modi Likely To Visit Ayodhya To Offer Puja On Eve Of Diwali,Prime Minister Narendra Modi may visit the construction site of the grand Ram temple in Ayodhya.,"Asian News International | Thursday October 20, 2022, New Delhi"
"Maratha Outfit Chief Attempts Suicide By Consuming Poison, Case Filed",Maratha Kranti Morcha (MKM) chief Ramesh Sheknath Kere allegedly consumed poison in an attempt to suicide. MRA Marg Police has filed a case under the same.,"Asian News International | Thursday October 20, 2022, Mumbai"
Arunachal People Have Learnt A Lot From Tibetan Settlers: Chief Minister,"Arunachal Pradesh Chief Minister Pema Khandu said that local people of the state have learnt so much from the 'Tibetan settlers' in practicing and keeping alive their traditional textile and handloom, their language and their rich culture.","Reported by Ratnadeep Choudhury, Edited by Amit Rajpurohit | Thursday October 20, 2022, Itanagar"
Andhra Pradesh Bureaucrat Aramane Giridhar To Be New Defence Secretary,Road Transport and Highways Secretary Aramane Giridhar has been named the new defence secretary as part of a top-level bureaucratic reshuffle effected by the Centre on Wednesday.,"Press Trust of India | Thursday October 20, 2022, New Delhi"
E-Gaming Federation To Challenge Tamil Nadu's Ban On Online Gaming,"E-gaming Federation will challenge an ordinance issued by the Tamil Nadu government to ban online gaming as it categorises rummy and poker as games of chance, the industry body said on Wednesday.","Press Trust of India | Thursday October 20, 2022, New Delhi"
"2 Cyclists Killed After Being Hit By Car In Gurgaon, Driver Arrested: cops","Two bicycle riders were killed after being hit by a car on the Golf Course Road here following which the driver, who is a college student, was nabbed, police said on Wednesday.","Press Trust of India | Thursday October 20, 2022, Gurgaon"
Amazon India Head Summoned By Child Rights Body,"Apex child rights body NCPCR has summoned global senior vice president and country head of Amazon India over alleged funding to All India Mission, an organisation involved in ""unlawful practices"".","Press Trust of India | Thursday October 20, 2022, New Delhi"
"""Highly Radicalised"" Operative Of ISIS Unit Caught: Anti-Terror Agency","A ""highly radicalised"" operative of the ISIS 'Voice of Hind' module was arrested as the National Investigation Agency raided two locations in Uttar Pradesh and Delhi on Wednesday, an official said.","Press Trust of India | Thursday October 20, 2022, New Delhi"
"Heavy Rain Batters Bengaluru, Many Roads Flooded, Cars Damaged","Heavy rains lashed the country's IT capital Bengaluru on Wednesday, flooding several arterial roads in the central part of the city, including the IT area Bellandur.","Reported by Sreeja M S | Thursday October 20, 2022, Bengaluru"
PM's Model Classroom Visit In Gujarat Gets Reaction From Arvind Kejriwal,Prime Minister Narendra Modi's visit to a model classroom in Gujarat ahead of assembly elections in the state drew eyes on social media today.,"NDTV News Desk | Thursday October 20, 2022, New Delhi"
Maharashtra Minister Apologises To Pune Citizens For Inconvenience Caused By Rain,Maharashtra minister and senior Bharatiya Janata Party (BJP) leader Chandrakant Patil on Wednesday apologised to the residents of Pune for the inconvenience caused to them as a result of unprecedented rains.,"Press Trust of India | Thursday October 20, 2022, Pune"
"China Puts On Hold India, US' Move At UN To Blacklist Hafiz Saeed's Son","China on Wednesday put a hold on a proposal by India and the US at the United Nations to blacklist Pakistan-based terrorist Hafiz Talah Saeed, the son of Lashkar-e-Taiba chief Hafiz Saeed, in the second such move within two days.","Press Trust of India | Wednesday October 19, 2022, United Nations"
"""He Is Elected Boss, He Will Be The Boss"": P Chidambaram After M Kharge's Win","Congress's P Chidambaram said today that Mallikarjun Kharge ""is elected the boss and will be the boss"" despite naysayers and critics who say otherwise.","Reported by Maha Siddiqui | Wednesday October 19, 2022, New Delhi"
Patel Nagar MLA Raaj Anand To Replace Rajendra Gautam In Delhi Cabinet,Chief Minister Arvind Kejriwal on Wednesday said he has recommended Patel Nagar MLA Raaj Kumar Anand's name to the lieutenant governor for including him in the Cabinet.,"Press Trust of India | Wednesday October 19, 2022, New Delhi"
AAP's Manish Sisodia Jibes At PM Modi On His Visit To Gujarat School,Delhi Deputy Chief Minister Manish Sisodia today said Prime Minister Narendra Modi visited a school in Gujarat and interacted with students by sitting on a bench with them when the people of the state have the option of bringing the AAP to power.,"Press Trust of India | Wednesday October 19, 2022, Gir Somnath, Gujarat"
"In Syndicate By Conman Sukesh Chandrashekhar At Delhi Jail, Probe Okayed Against 82 Officials",Lieutenant Governor VK Saxena has granted permission to the Economic Offences Wing (EOW) of the city police for investigating the role of 82 Delhi Prison Department officials in the organized crime syndicate being run by conman Sukesh Chandrashekhar.,"Press Trust of India | Wednesday October 19, 2022, New Delhi"
Ex AAP Leader Tahir Hussain Discharged In A Case Related To Delhi Riots,"A Delhi Court, hearing North East Delhi riots cases, on Wednesday discharged former AAP councillor Tahir Hussain and nine other accused persons for the offence of committing mischief by fire or explosive substance with intent to destroy property.","Asian News International | Wednesday October 19, 2022, New Delhi"
Maharashtra Minister Nawab Malik's Judicial Custody Extended Till November 2,A special court in Mumbai on Wednesday extended the judicial custody of Nationalist Congress Party leader Nawab Malik till November 2 in an alleged money laundering case.,"Press Trust of India | Wednesday October 19, 2022, Mumbai"
"Sharad Pawar On Stage, Eknath Shinde Says ""Sleepless Nights For Some""","Maharashtra Chief Minister Eknath Shinde, his deputy Devendra Fadnavis and BJP leader Ashish Shelar on Wednesday shared the dais with NCP chief Sharad Pawar at a special dinner held on the eve of the Mumbai Cricket Association (MCA) polls.","Press Trust of India | Wednesday October 19, 2022, Mumbai"
"Sharad Pawar On Stage, Eknath Shinde Says ""Sleepless Nights For Some""","Maharashtra Chief Minister Eknath Shinde, his deputy Devendra Fadnavis and BJP leader Ashish Shelar on Wednesday shared the dais with NCP chief Sharad Pawar at a special dinner held on the eve of the Mumbai Cricket Association (MCA) polls.","Press Trust of India | Wednesday October 19, 2022, Mumbai"
"Punjab Wants To Hire Aircraft For VIP Use, Opposition Asks What's The Need","The Punjab government has floated a tender to hire an aircraft for VIP movement for a year, drawing sharp criticism from the Opposition which alleged it aimed at facilitating trips of AAP chief Arvind Kejriwal.","Press Trust of India | Wednesday October 19, 2022, Chandigarh"
"Mining Official Seeks Sexual Favour From Mine Owner's Wife, Gets Bail","A court in Madhya Pradesh's Ratlam sentenced a mining department official to judicial custody for demanding sexual favours from a woman five months ago, after her mine owner husband was found allegedly indulging in irregularities.","Press Trust of India | Wednesday October 19, 2022, Ratlam, Madhya Pradesh"
Himachal Chief Minister Jairam Thakur Files Nomination Ahead Of Polls,Himachal Pradesh Chief Minister Jai Ram Thakur on Wednesday filed his nomination from his traditional seat of Seraj in Mandi district for the assembly polls in the state.,"Asian News International | Wednesday October 19, 2022, Mandi"
Delhi Hospital Successfully Treats Iraq Boy With Rare Leg Deformity,"A teenage boy from Iraq with severe deformity of legs has been successfully treated at a private hospital in Delhi, according to a statement.","Press Trust of India | Wednesday October 19, 2022, New Delhi"
21 Children Living On Delhi Streets Admitted To Civic Body-Run School,"Twenty-one children living under a flyover along with their parents and resorted to begging for livelihood have been admitted to a civic body-run school under a rehabilitation drive, the Municipal Corporation of Delhi said Wednesday.","Press Trust of India | Wednesday October 19, 2022, New Delhi"
Nagaland Factions Agree On Formation Of Common Body Over Peace Talks,Naga Peace Talks: Two Naga factions -- NSCN-IM and NNPGs -- have agreed to form a common body to explore ways and move forward towards finding a solution to the imbroglio over the Naga peace talks.,"Press Trust of India | Wednesday October 19, 2022, Kolkata"
Supreme Court Bench Hears Arguments Via Cell Phone Due To Technical Issues,"Facing technical problems, a Supreme Court bench headed by Justice DY Chandrachud on Wednesday heard arguments of a petitioner using a cell phone on speaker mode.","Press Trust of India | Wednesday October 19, 2022, New Delhi"
#MeToo Back In Spotlight With Filmmaker Sajid Khan Joining 'Bigg Boss',"The #MeToo debate is back with filmmaker Sajid Khan returning to mainstream entertainment as a participant on ""Bigg Boss"" and at least two of the women who accused him of sexual harassment publicly expressing their anguish.","Press Trust of India | Wednesday October 19, 2022, Mumbai"
"Video: Man Turns Cooler On, Woman Loses Cool. Then This Happens","The man was sleeping in the hospital's waiting hall at night with the air cooler on, when the woman arrived and switched it off. When he asked the woman why she had turned the cooler off, she lost her cool and attacked him","Reported by Anurag Dwary, Edited by Sanjib Kumar Das | Wednesday October 19, 2022, Raipur"
"Won't Allow Division Of West Bengal, Says Mamata Banerjee",Chief Minister Mamata Banerjee on Wednesday said she won't allow the division of West Bengal.,"Press Trust of India | Wednesday October 19, 2022, Siliguri"
"""Leave At The Earliest"": India To Citizens In Ukraine As War Escalates",The advisory came as Russian President Vladimir Putin introduced martial law in four Ukrainian regions and residents feared a fresh assault in some parts of the country.,"NDTV News Desk | Wednesday October 19, 2022, New Delhi"
"Girl, 4, Had Leg Pain. It Revealed Molestation. Principal's Driver Caught","In a shocking incident, a four-and-a-half-year-old girl was allegedly sexually assaulted by a driver in her school in an upmarket neighbourhood in Hyderabad, police said today.","Press Trust of India | Wednesday October 19, 2022, Hyderabad"
